{"claim":{"id":"release.ready","required_steps":["unit-python","unit-node"],"statement":"The declared Python and Node checks passed under the approved workflow."},"description":"Cross-language verification contract fixture.","evidence_policy":{"preserve_lifecycle":["queued","running","completed","cancelled","failed","stale","superseded"],"preserve_verdicts":["PASS","FAIL","INCONCLUSIVE","INVALID"],"retain_attempts":"all"},"repository":{"commit":"1111111111111111111111111111111111111111","remote":"https://github.com/example/widget.git","tree_digest":"sha256:2222222222222222222222222222222222222222222222222222222222222222"},"revision":1,"schema_version":"incidentseal-workflow/v1","security":{"container_engine_control":"host-cli-only","docker_socket":"denied","host_mount_mode":"staged-read-only","host_network":false,"privileged":false,"runtime_egress":"denied","secrets":"denied"},"steps":[{"capture":{"max_bytes":1048576,"stderr":"full","stdout":"full"},"command":["python","-m","unittest","discover","-s","tests/python"],"cwd":".","depends_on":[],"expected_exit_codes":[0],"id":"unit-python","inputs":["src","tests/python"],"network":"none","outputs":[],"runner":"python","timeout_seconds":120},{"capture":{"max_bytes":1048576,"stderr":"full","stdout":"full"},"command":["node","--test","tests/node"],"cwd":".","depends_on":[],"expected_exit_codes":[0],"id":"unit-node","inputs":["src","tests/node"],"network":"none","outputs":[],"runner":"node","timeout_seconds":120}],"workflow_id":"example.release"}
